NAME,LATITUDE,LONGITUDE,ADDRESS_MYENV,DESCRIPTION_MYENV,ADDRESSTYPE,ADDRESSBLOCKHOUSENUMBER,ADDRESSFLOORNUMBER,ADDRESSUNITNUMBER,ADDRESSSTREETNAME,ADDRESSPOSTALCODE,ADDRESSBUILDINGNAME,REGION,PHOTOURL,STATUS,RNR_STATUS,APPROXIMATE_GFA,AWARDED_DATE,CLEANINGENDDATE,CLEANINGSTARTDATE,DESCRIPTION,EST_ORIGINAL_COMPLETION_DATE,FMEL_UPD_D,HUP_COMPLETION_DATE,HYPERLINK,IMPLEMENTATION_DATE,INC_CRC,INFO_ON_CO_LOCATORS,LANDXADDRESSPOINT,LANDYADDRESSPOINT,NO_OF_FOOD_STALLS,NO_OF_MARKET_STALLS,point_lat,point_lon
Toa Payoh Lorong 5 Blk 75,1.33609998,103.8529968,"Blk 75, Lorong 5 Toa Payoh, Singapore 310075","Built in 1968, this standalone food centre at Blk 75 Lorong 5 Toa Payoh comprises 36 cooked food stalls.",I,75,,,Lorong 5 Toa Payoh,310075,,Central,http://www.nea.gov.sg/images/default-source/Hawker-Centres-Division/resize_1267878144152.jpg,Existing,Completed,,,1/3/2021,1/3/2021,HUP Standard Upgrading,5/2/1968,20201228124030,21/11/2012,,,83FB95F6519D1414,,30183.83,35357.91,36,0,1.33603882157063,103.852941556275
Toa Payoh Lorong 7 Blk 22 (Kim Keat Palm Market and Food Centre),1.3352899599999999,103.8570633,"Blk 22, Lorong 7 Toa Payoh, Singapore 310022","Built in 1970, the hawker centre at Blk 22 Lorong 7 Toa Payoh serves the Kim Keat residents and nearby industrial parks. There are 61 cooked food stalls and 59 market stalls in the hawker centre.  Be pampered by delicious hawker fare such as Oyster Omelette, Fishball Noodles, Zi Char etc!",I,22,,,Lorong 7 Toa Payoh,310022,,Central,http://www.nea.gov.sg/images/default-source/Hawker-Centres-Division/resize_1265168256123.jpg,Existing,<R&R> 01/03/2021 to 30/04/2021,,,TBC,TBC,HUP Reconfiguration,2/3/1970,20210222124820,16/7/2004,,,E43A2111F9153E01,,30639.5,35268.64,61,59,1.33523145909678,103.857036007166
Toa Payoh Lorong 8 Blk 210,1.34033001,103.8544617,"Blk 210, Lorong 8 Toa Payoh, Singapore 310210","Built in 1974, this hawker centre houses 80 cooked food stalls and 77 market stalls. One of the largest hawker centres in the Toa Payoh vicinity.",I,210,,,Lorong 8 Toa Payoh,310210,,Central,http://www.nea.gov.sg/images/default-source/Hawker-Centres-Division/resize_1267876959422.jpg,Existing,Completed,,,5/1/2021,4/1/2021,HUP Standard Upgrading,27/8/1974,20201228124030,30/9/2011,,,AD6CE8507CA76F0C,,30345.61,35824.76,80,77,1.3402608349586,103.854395279214
Upper Boon Keng Road Blk 17 (Blk 17 Upper Boon Keng Market and Food Centre),1.31508994,103.8716812,"Blk 17, Upper Boon Keng Road, Singapore 380017","Upgraded in 2009, the hawker centre at Blk 17 Upper Boon Keng comprises 84 cooked food stalls and 60 market stalls. The hawker centre serves the nearby residential and industrial estates.",I,17,,,Upper Boon Keng Road,380017,,Central,http://www.nea.gov.sg/images/default-source/Hawker-Centres-Division/resize_1262226056435.jpg,Existing,Completed,,,23/3/2021,22/3/2021,HUP Standard Upgrading,28/2/1974,20201228124030,13/1/2009,,,5A26A7AC823E0822,,32262.61,33034.67,84,60,1.31502804429519,103.871620273635
Upper Cross Street Blk 531A (Hong Lim Food Centre and Market),1.28446996,103.8458633,"Blk 531A, Upper Cross Street, Singapore 051531","Also known as Hong Lim Food Centre, the hawker centre is famous for dishes such as Bak Ku Teh, Crayfish Hor Fun, Curry Chicken Noodles, Fish Head Bee Hoon etc. Expect to see long queues at different stalls, especially during lunch hours. Apart from the 103 cooked food stalls, the hawker centre also has 40 market stalls to serve the needs of the residents in the vicinity.",,531A,,,Upper Cross Street,051531,,Central,http://www.nea.gov.sg/images/default-source/Hawker-Centres-Division/resize_1267878882405.jpg,Existing,Completed,,,23/3/2021,22/3/2021,HUP Reconfiguration,28/1/1978,20210202110628,9/3/2011,,,A606939375AE255A,,29391.18,29741.54,103,40,1.28524640047048,103.845818885585
West Coast Drive Blk 502 (Ayer Rajah Market),1.3119599800000001,103.7591019,"Blk 502, West Coast Drive, Singapore 120502","Also known as Ayer Rajah Market, the standalone market is located next to Ayer Rajah Food Centre. One of the last few hawker centres built, construction was completed in 1995 to complement Ayer Rajah Food Centre. There are 68 market stalls at the market to serve the West Coast area.",I,502,,,West Coast Drive,120502,,West,http://www.nea.gov.sg/images/default-source/Hawker-Centres-Division/resize_1265168297394.jpg,Existing,Completed,,,15/3/2021,15/3/2021,Not eligible for HUP,19/1/1995,20201228124030,,,,2DBB0A9F8B1DD16B,,19747.53,32687.74,0,68,1.31188972115897,103.759166093858
West Coast Drive Blk 503 (Ayer Rajah Food Centre),1.31186998,103.7598038,"Blk 503, West Coast Drive, Singapore 120503","Also known as Ayer Rajah Food Centre, the standalone food centre was originally built in 1979.  The centre is located next to Ayer Rajah Market and currently houses 80 cooked food stalls to serve the West Coast area.",I,503,,,West Coast Drive,120503,,West,http://www.nea.gov.sg/images/default-source/Hawker-Centres-Division/resize_1265168322420.jpg,Existing,Completed,,,16/3/2021,15/3/2021,HUP Standard Upgrading,26/3/1979,20201228124030,15/12/2002,,,7A2798348042C52A,,19812.66,32678.15,80,0,1.31180301004196,103.759751321019
Whampoa Drive Blk 90 (Whampoa Drive Makan Place/Whampoa Food Centre),1.32314003,103.8550415,"Blk 90, Whampoa Drive, Singapore 320090","Known also as Whampoa Drive Makan Place, this is one hawker centre in Singapore which has become inceasingly famous over the years. Patrons can easily find popular stalls serving up excellent dishes to satisfy their palate. Be prepared to wait during peak hours as the premise is packed with diners!",I,90,,,Whampoa Drive,320090,,Central,http://www.nea.gov.sg/images/default-source/Hawker-Centres-Division/resize_1262154207158.jpg,Existing,Completed,,,16/3/2021,16/3/2021,HUP Standard Upgrading,26/8/1976,20201228124030,25/10/2007,,,16F08FA0FB1938AD,,30428.25,33909.85,80,12,1.32294306204189,103.855137696535
Whampoa Drive Blk 91/92 (Whampoa Drive Makan Place/Whampoa Market),1.32349002,103.8541336,"Blk 91/92, Whampoa Drive, Singapore 320091/320092","Known also as Whampoa Drive Makan Place, this is one hawker centre in Singapore which has become inceasingly famous over the years. Patrons can easily find popular stalls serving up excellent dishes to satisfy their palate. Be prepared to wait during peak hours as the premise is packed with diners!",I,91/92,,,Whampoa Drive,320091,,Central,http://www.nea.gov.sg/images/default-source/Hawker-Centres-Division/resize_1262154257763.jpg,Existing,Completed,,,15/3/2021,15/3/2021,HUP Standard Upgrading,3/1/1973,20201228124030,25/10/2007,,,38A4F531D4EFDE9D,,30309.21,33962.78,52,112,1.32342175143826,103.85406806286
Woodleigh Village Hawker Centre,,,,,,202C,,,Woodleigh Link,363202,Woodleigh Village,,,Under Construction,#N/A,,30/6/2017,#N/A,#N/A,New Centre,2021,20201030102222,,,21/7/2017,7729E118EAD6161D,hawker centre/flats/bus interchange,32314.87,35773.4,,,1.3397961360031,103.872090241567
Yishun Park Hawker Centre,1.424911,103.844992,"Blk 51, Yishun Avenue 11, Singapore 768867","Built in 2017, the hawker centre at Yishun Park consists of 45 cooked food stalls and allows patrons of all ages to enjoy affordable food in a pleasant dining environment.  The centre features natural ventilation, family-friendly features, such as child-friendly toilet facilities and family-friendly seating, and built-in tray-return facilities at accessible locations.",,51,,,Yishun Avenue 11,768867,Yishun Park Hawker Centre,Central,http://www.nea.gov.sg/images/default-source/Hawker-Centres-Division/yishun-hawker-centre.jpg,Existing (new),,3364,23/10/2015,9/3/2021,8/3/2021,New Centre,3/7/2017,20201228124030,,,25/11/2015,2676B6596B95A8EB,,29271.88,45196.73,45,0,1.42501763803265,103.844747581861
Yishun Ring Road Blk 104/105 (Chong Pang Market and Food Centre),1.43165803,103.8280716,"Blk 104/105, Yishun Ring Road, Singapore 760104/760105","Built in 1984, the hawker centre comprises 56 cooked food stalls and 123 market stalls. Residents of Chong Pang patronise the centre for its wide selection of local cuisines.",I,104/105,,,Yishun Ring Road,760104,,North,http://www.nea.gov.sg/images/default-source/Hawker-Centres-Division/resize_1267438077554.jpg,Existing,Completed,,,22/3/2021,22/3/2021,HUP Standard Upgrading,31/3/1984,20210202110628,4/8/2003,,,A75CB1D52BCD864D,,27467.95,45907.73,56,123,1.43144768831222,103.828537609942
Zion Riverside Food Centre,1.29234004,103.8311844,"70, Zion Road, Singapore 247792","Located opposite Great World City, Zion Riverside Food Centre boasts a huge reputation even with its relatively small footprint of 32 cooked food stalls. Built since 1976, patrons can find a variety of good food offerings at the centre. Popular with both locals and tourists alike.",I,70,,,Zion Road,247792,,Central,http://www.nea.gov.sg/images/default-source/Hawker-Centres-Division/resize_1267879560483.jpg,Existing,<R&R> 01/11/2020 to 28/02/2021,1421.31,,TBC,TBC,HUP Standard Upgrading,1976,20210222124820,5/3/2003,,,41709ABE53369DF6,,27763.03,30526.15,32,0,1.29234216757957,103.831189303546
